,id,page_id,item,parent_id,title,debate_id,length,level,thread_id,author,platform,stance
92,1096_k_2_0092,1096,"A UBI could compensate [92] non-waged care workers, alleviating the stress - both financial and mental - that can often come from providing this care.",1096_k_2_0087,Should universal basic income be established?,dk_1096_2,150,3,1096_k_0018,,kialo,pro
93,1096_k_2_0093,1096,"If a UBI is implemented, more children may have their parents stay at home [93] to care for them, strengthening the child-parent bond.",1096_k_2_0087,Should universal basic income be established?,dk_1096_2,134,3,1096_k_0018,,kialo,pro
94,1096_k_2_0094,1096,"People should not be compensated for actions that only benefit themselves, such as housework.",1096_k_2_0086,Should universal basic income be established?,dk_1096_2,93,2,1096_k_0018,,kialo,con
95,1096_k_2_0095,1096,"Housework and garden work is a key aspect [94] of keeping a living area and neighborhood clean and approachable for all members of a community, making the world a better place.",1096_k_2_0094,Should universal basic income be established?,dk_1096_2,176,3,1096_k_0018,,kialo,con
96,1096_k_2_0096,1096,"The completion of housework is a basic aspect of living well that does not produce any further goods for society. Thus, a wage is neither needed to incentivise it, nor to recognise the good it contributes to the world.",1096_k_2_0094,Should universal basic income be established?,dk_1096_2,218,3,1096_k_0018,,kialo,pro
97,1096_k_2_0097,1096,"A UBI is not compensation for work, but rather an income provided based on the recognition [95] that a precondition for participation in society nowadays is adequate funds.",1096_k_2_0094,Should universal basic income be established?,dk_1096_2,172,3,1096_k_0018,,kialo,con
98,1096_k_2_0098,1096,"Having a UBI could increase volunteer support for nonprofit organizations, as people can reduce [96] their paid workload to spend more time working on passion projects.",1096_k_2_0086,Should universal basic income be established?,dk_1096_2,168,2,1096_k_0018,,kialo,pro
99,1096_k_2_0099,1096,"Volunteering rates [97] decrease with economic downturns as people must forego helping others to meet their own needs. Thus, a UBI would likely increase volunteering.",1096_k_2_0098,Should universal basic income be established?,dk_1096_2,166,3,1096_k_0018,,kialo,pro
100,1096_k_2_0100,1096,"Few people spend their leisure time [98] volunteering, this is unlikely to change with the introduction of a UBI as people may opt to just do more lavish versions of their current hobbies.",1096_k_2_0098,Should universal basic income be established?,dk_1096_2,188,3,1096_k_0018,,kialo,con
101,1096_k_2_0101,1096,"It would be better to fund or increase the rewards [99] associated with volunteer-supported organizations so they can recruit more people more reliably, than seek to pay everyone a UBI.",1096_k_2_0098,Should universal basic income be established?,dk_1096_2,185,3,1096_k_0018,,kialo,con
102,1096_k_2_0102,1096,"Lots of people are interested in volunteering [100], a UBI allows them to do this without impinging on their quality of life.",1096_k_2_0098,Should universal basic income be established?,dk_1096_2,125,3,1096_k_0018,,kialo,pro
103,1096_k_2_0103,1096,UBI is intended to be a minimal income and so receipt of it is unlikely to be perceived as recognition for one's hard work.,1096_k_2_0086,Should universal basic income be established?,dk_1096_2,123,2,1096_k_0018,,kialo,con
104,1096_k_2_0104,1096,"As everyone receives a UBI, it does not follow that people will attribute more value to the completion of previously unpaid labor. Instead, sexist divisions [101] of labor that mean women work the second shift [102] may remain.",1096_k_2_0103,Should universal basic income be established?,dk_1096_2,227,3,1096_k_0018,,kialo,pro
105,1096_k_2_0105,1096,"Even if women's typically unpaid work is not perceived to be more valuable with a UBI, they would be in a stronger financial position such that they could leave [103] abusive households more easily or have more autonomy within the home.",1096_k_2_0103,Should universal basic income be established?,dk_1096_2,236,3,1096_k_0018,,kialo,con
